{
    "$schema": "https://json-schema.org/draft-07/schema",
    "type": "object",
    "properties": {
        "name": {"type": "string"},
        "state": {"type": "string"},
        "elevation": {"type": "string"},
        "weather": {"type": "string"},
        "description": {"type": "string"},
        "tags": {
            "type": "array",
            "items": {"type": "string"}
        }
    },
    "required": ["name", "state", "elevation", "weather", "description", "tags"]
}